<?xml version="1.0" encoding="utf-8"?>
<xs:schema attributeFormDefault="unqualified" elementFormDefault="qualified" xmlns:xs="http://www.w3.org/2001/XMLSchema">

  <xs:element name="proveidors" type="tipusProveidors"/>

  <xs:complexType name="tipusProveidors">
    <xs:sequence>
      <xs:element name="proveidor" type="tipusProveidor" maxOccurs="unbounded"/>
    </xs:sequence>
  </xs:complexType>

  <xs:complexType name="tipusProveidor">
    <xs:sequence>
      <xs:element name="codi" type="tipusCodi"/>
      <xs:element name="nom" type ="xs:string"/>
      <xs:element name="adreça" type="xs:string"/>
      <xs:element name="poblacio" type="xs:string"/>
      <xs:element name="cp" type="tipusCp"/>
    </xs:sequence>
  </xs:complexType>

  <xs:simpleType name="tipusCodi">
    <xs:restriction base="xs:string">
      <xs:minLength value="1"/>
      <xs:maxLength value="4"/>
    </xs:restriction>
  </xs:simpleType>

  <xs:simpleType name="tipusCp">
    <xs:restriction base="xs:string">
      <xs:pattern value="[0-9]{5}"/>
    </xs:restriction>
  </xs:simpleType>
  
</xs:schema>
