<?xml version="1.0"?>
<proveidors xmlns:xsi="http://www.w3.org/2001/XMLSchema-instance" xsi:noNamespaceSchemaLocation="proveidors.xsd">
<proveidor>
	<codi>CP10</codi>
	<nom>Comercial paperera, materials doficina</nom>
	<adreça>Pol. Ind Mas Xirgu II</adreça>
	<poblacio>Girona</poblacio>
	<cp>17005</cp>
</proveidor>   
<proveidor>
	<codi>AB11</codi>
	<nom>Abacus Cooperativa</nom>
	<adreça>Carretera de Barcelona, 42-44</adreça>
	<poblacio>Girona</poblacio>
	<cp>17002</cp>
</proveidor>  
<proveidor>
	<codi>MSS1</codi>
	<nom>Massegur</nom>
	<adreça>Plaça Calvet i Rubalcava, 8</adreça>
	<poblacio>Girona</poblacio>
	<cp>17002</cp>
</proveidor>  
<proveidor>
	<codi>BBCP</codi>
	<nom>Bisbal Copy</nom>
	<adreça>C/Solidaritat, 40</adreça>
	<poblacio>La Bisbal dEmpordà</poblacio>
	<cp>17100</cp>
</proveidor>
<proveidor>
	<codi>NPP</codi>
	<nom>Neus Paper</nom>
	<adreça>Hortes, 17</adreça>
	<poblacio>Girona</poblacio>
	<cp>17010</cp>
</proveidor> 
</proveidors> 